{
  "contract_format_version": 1,
  "kind": "nondeterministic_review_contract",
  "name": "ceratops_code_repo_nondeterministic_contract",
  "surface": "code",
  "deterministic_contract": "code-repo-deterministic-contract.json",
  "description": "Repository-content quality and intent checks that require AI-agent judgment.",
  "evidence": {
    "command": "python -m github_contract_engine collect --surface code --repo OWNER/REPO --local-repo-path PATH --json",
    "notes": [
      "Collect a separate repository evidence bundle when live labels, Dependabot queues, alerts, or repository settings are also in scope."
    ]
  },
  "review_result_values": {
    "pass": "AI-agent review found the intent satisfied and recorded evidence.",
    "fail": "AI-agent review found a concrete mismatch.",
    "approved_drift": "The mismatch is allowed by the deterministic contract's approved drift profile.",
    "blocked": "Review needs an unavailable local checkout, missing product decision, or unavailable validation endpoint.",
    "not_applicable": "Repository type or source does not apply."
  },
  "checks": [
    {
      "id": "ND.code.public-content-quality",
      "applies_when": "Public or internal content files are expected.",
      "review_required": "Confirm README, license, security policy, contribution guide, code of conduct, examples, installation documentation, issue forms, pull-request templates, and support documentation are repository-specific rather than placeholders.",
      "evidence_keys": ["local.files", "local.texts"]
    },
    {
      "id": "ND.code.support-routing-quality",
      "applies_when": "The repository has homepage, support, discussion, issue, or SUPPORT.md routes.",
      "review_required": "Confirm support routing targets an active channel and does not conflict with issue templates or security reporting.",
      "evidence_keys": ["repository.repo.homepage", "local.files"]
    },
    {
      "id": "ND.code.workflow-intent-and-pin-verification",
      "applies_when": "The repository has workflow files.",
      "review_required": "Confirm each workflow has a valid purpose, release workflows match artifact surfaces, full-SHA comments identify the intended release, and reusable-workflow tags are deliberate.",
      "evidence_keys": ["local.workflows"]
    },
    {
      "id": "ND.code.dependabot-policy-fit",
      "applies_when": "Package manifests or .github/dependabot.yml are present.",
      "review_required": "Confirm ecosystems, grouping, open-pull-request limits, private registries, labels, and update cadence fit the repository instead of only being syntactically valid.",
      "evidence_keys": ["local.dependabot", "repository.content.dependabot"]
    },
    {
      "id": "ND.code.local-state-classification",
      "applies_when": "Dirty Git state, generated files, local paths, or old automation references are present.",
      "review_required": "Classify each item as active, intentionally retained, approved drift, stale, or blocked before cleanup.",
      "evidence_keys": ["local", "local.git"]
    },
    {
      "id": "ND.code.secret-pattern-intent",
      "applies_when": "Secret-like patterns are detected in local text.",
      "review_required": "Classify each match as a real secret, safe placeholder, fixture, documentation example, approved drift, or blocked remediation.",
      "evidence_keys": ["local.scans.content.local_secret_pattern_scan"]
    },
    {
      "id": "ND.code.comment-sufficiency",
      "applies_when": "Scripts, public APIs, automation helpers, contract checkers, or non-obvious safety logic are in scope.",
      "review_required": "Apply the code-comment nondeterministic contract and confirm comments explain intent, safety boundaries, external side effects, and public usage without restating obvious code.",
      "evidence_keys": ["skills/ceratops-gh-repo-lifecycle/references/contracts/code-comment-nondeterministic-contract.json", "local.files"]
    },
    {
      "id": "ND.code.sources-current-doc-recheck",
      "applies_when": "A repository-content convention or generated-file behavior matters and local evidence is ambiguous.",
      "review_required": "Recheck only the relevant official documentation or local project standard before deciding drift.",
      "evidence_keys": ["github-contract-source-docs.json"]
    }
  ]
}
